{
  "abilities": [
    {
      "ability": "str",
      "modifier": -1,
      "save": -1,
      "saveProficiency": "none",
      "score": 8
    },
    {
      "ability": "dex",
      "modifier": 1,
      "save": 1,
      "saveProficiency": "none",
      "score": 12
    },
    {
      "ability": "con",
      "modifier": 2,
      "save": 2,
      "saveProficiency": "none",
      "score": 14
    },
    {
      "ability": "int",
      "modifier": 3,
      "save": 6,
      "saveProficiency": "proficient",
      "score": 16
    },
    {
      "ability": "wis",
      "modifier": 1,
      "save": 4,
      "saveProficiency": "proficient",
      "score": 12
    },
    {
      "ability": "cha",
      "modifier": 0,
      "save": 0,
      "saveProficiency": "none",
      "score": 10
    }
  ],
  "attacks": [],
  "character": {
    "classes": [
      {
        "hitDie": 8,
        "level": 5,
        "name": "Test Chronicler",
        "ref": {
          "contentId": "5fc0c000-0000-4000-8000-000000000001",
          "revisionId": "5fc0e000-0000-4000-8000-000000000001"
        },
        "source": "TomeStack Fixtures: Test Chronicler"
      }
    ],
    "level": 5,
    "name": "Test Chronicler Five",
    "rulesFamily": "srd-5.2.1"
  },
  "conditions": {
    "active": [],
    "exhaustion": 0
  },
  "dropped": [],
  "exportedAt": "2026-09-24T12:00:00+00:00",
  "features": [
    {
      "automation": "assisted",
      "kind": "class",
      "name": "Test Chronicler",
      "ref": {
        "contentId": "5fc0c000-0000-4000-8000-000000000001",
        "revisionId": "5fc0e000-0000-4000-8000-000000000001"
      },
      "source": "TomeStack Fixtures: Test Chronicler",
      "summary": "A test class with its own columns and a two-thirds caster share.",
      "texts": [
        "To multiclass into or out of this class: Intelligence 13.",
        "Spend 1 ink: 1d6 plus your Lore column.",
        "Test Chronicler casts from the fixture-chronicle list (invented test progression; two thirds of its levels count as a multiclass caster).",
        "Choose an archive."
      ]
    },
    {
      "automation": "automatic",
      "kind": "feature",
      "name": "Test Chronicler: Marginalia",
      "ref": {
        "contentId": "5fc0c000-0000-4000-8000-000000000002",
        "revisionId": "5fc0e000-0000-4000-8000-000000000002"
      },
      "source": "TomeStack Fixtures: Test Chronicler",
      "summary": "A test feature that reads its class's Ink column.",
      "texts": []
    }
  ],
  "fields": [
    {
      "automation": "automatic",
      "id": "armorClass",
      "label": "Armor Class",
      "overridden": false,
      "value": 11
    },
    {
      "automation": "automatic",
      "id": "initiative",
      "label": "Initiative",
      "overridden": false,
      "value": 2
    },
    {
      "automation": "automatic",
      "id": "proficiencyBonus",
      "label": "Proficiency bonus",
      "overridden": false,
      "value": 3
    },
    {
      "automation": "automatic",
      "id": "hitPoints",
      "label": "Hit point maximum",
      "overridden": false,
      "value": 38
    },
    {
      "automation": "automatic",
      "id": "spellAttack",
      "label": "Spell attack bonus",
      "overridden": false,
      "value": 6
    },
    {
      "automation": "automatic",
      "id": "spellSaveDc",
      "label": "Spell save DC",
      "overridden": false,
      "value": 14
    }
  ],
  "format": "tomestack.sheet",
  "formatVersion": 1,
  "hitDice": [
    {
      "die": 8,
      "spent": 0,
      "total": 5
    }
  ],
  "hitPoints": {
    "current": 38,
    "maximum": 38,
    "temporary": 0
  },
  "notices": [
    {
      "attribution": "Written for TomeStack tests.",
      "license": "Original test fixture",
      "publisher": "TomeStack project",
      "redistributable": true,
      "title": "TomeStack Fixtures: Test Chronicler",
      "totalsOnly": false
    }
  ],
  "purpose": "share",
  "resources": [
    {
      "feature": "Test Chronicler",
      "label": "Ink",
      "maximum": 4,
      "recovery": [
        "LongRest: all",
        "ShortRest: floor(SCALE.ink / 2)"
      ],
      "ref": {
        "contentId": "5fc0c000-0000-4000-8000-000000000001",
        "revisionId": "5fc0e000-0000-4000-8000-000000000001"
      },
      "source": "TomeStack Fixtures: Test Chronicler",
      "spent": 0
    }
  ],
  "scales": [
    {
      "className": "Test Chronicler",
      "label": "Ink",
      "ref": {
        "contentId": "5fc0c000-0000-4000-8000-000000000001",
        "revisionId": "5fc0e000-0000-4000-8000-000000000001"
      },
      "source": "TomeStack Fixtures: Test Chronicler",
      "value": 4
    },
    {
      "className": "Test Chronicler",
      "label": "Lore",
      "ref": {
        "contentId": "5fc0c000-0000-4000-8000-000000000001",
        "revisionId": "5fc0e000-0000-4000-8000-000000000001"
      },
      "source": "TomeStack Fixtures: Test Chronicler",
      "value": 2
    }
  ],
  "skills": [
    {
      "ability": "dex",
      "label": "Acrobatics",
      "proficiency": "none",
      "skill": "acrobatics",
      "total": 1
    },
    {
      "ability": "wis",
      "label": "Animal Handling",
      "proficiency": "none",
      "skill": "animalHandling",
      "total": 1
    },
    {
      "ability": "int",
      "label": "Arcana",
      "proficiency": "none",
      "skill": "arcana",
      "total": 3
    },
    {
      "ability": "str",
      "label": "Athletics",
      "proficiency": "none",
      "skill": "athletics",
      "total": -1
    },
    {
      "ability": "cha",
      "label": "Deception",
      "proficiency": "none",
      "skill": "deception",
      "total": 0
    },
    {
      "ability": "int",
      "label": "History",
      "proficiency": "none",
      "skill": "history",
      "total": 5
    },
    {
      "ability": "wis",
      "label": "Insight",
      "proficiency": "none",
      "skill": "insight",
      "total": 1
    },
    {
      "ability": "cha",
      "label": "Intimidation",
      "proficiency": "none",
      "skill": "intimidation",
      "total": 0
    },
    {
      "ability": "int",
      "label": "Investigation",
      "proficiency": "none",
      "skill": "investigation",
      "total": 3
    },
    {
      "ability": "wis",
      "label": "Medicine",
      "proficiency": "none",
      "skill": "medicine",
      "total": 1
    },
    {
      "ability": "int",
      "label": "Nature",
      "proficiency": "none",
      "skill": "nature",
      "total": 3
    },
    {
      "ability": "wis",
      "label": "Perception",
      "proficiency": "none",
      "skill": "perception",
      "total": 1
    },
    {
      "ability": "cha",
      "label": "Performance",
      "proficiency": "none",
      "skill": "performance",
      "total": 0
    },
    {
      "ability": "cha",
      "label": "Persuasion",
      "proficiency": "none",
      "skill": "persuasion",
      "total": 0
    },
    {
      "ability": "int",
      "label": "Religion",
      "proficiency": "none",
      "skill": "religion",
      "total": 3
    },
    {
      "ability": "dex",
      "label": "Sleight of Hand",
      "proficiency": "none",
      "skill": "sleightOfHand",
      "total": 1
    },
    {
      "ability": "dex",
      "label": "Stealth",
      "proficiency": "none",
      "skill": "stealth",
      "total": 1
    },
    {
      "ability": "wis",
      "label": "Survival",
      "proficiency": "none",
      "skill": "survival",
      "total": 1
    }
  ],
  "slots": [
    {
      "level": 1,
      "maximum": 3,
      "spent": 0
    },
    {
      "level": 2,
      "maximum": 2,
      "spent": 0
    }
  ],
  "spellcasting": [
    {
      "ability": "int",
      "attackBonus": 6,
      "classLevel": 5,
      "name": "Test Chronicler",
      "preparation": "prepared",
      "ref": {
        "contentId": "5fc0c000-0000-4000-8000-000000000001",
        "revisionId": "5fc0e000-0000-4000-8000-000000000001"
      },
      "saveDc": 14,
      "source": "TomeStack Fixtures: Test Chronicler",
      "spells": []
    }
  ],
  "toggles": []
}
