{
  "abilities": [
    {
      "ability": "str",
      "modifier": 3,
      "save": 5,
      "saveProficiency": "proficient",
      "score": 16
    },
    {
      "ability": "dex",
      "modifier": 1,
      "save": 3,
      "saveProficiency": "proficient",
      "score": 12
    },
    {
      "ability": "con",
      "modifier": 2,
      "save": 2,
      "saveProficiency": "none",
      "score": 14
    },
    {
      "ability": "int",
      "modifier": 0,
      "save": 0,
      "saveProficiency": "none",
      "score": 10
    },
    {
      "ability": "wis",
      "modifier": 0,
      "save": 0,
      "saveProficiency": "none",
      "score": 10
    },
    {
      "ability": "cha",
      "modifier": -1,
      "save": -1,
      "saveProficiency": "none",
      "score": 8
    }
  ],
  "attacks": [
    {
      "damage": "1d8+3",
      "damageType": "slashing",
      "name": "Fixture Longblade",
      "proficient": true,
      "properties": [
        "versatile"
      ],
      "ref": {
        "contentId": "5f6dc000-0000-4000-8000-000000000001",
        "revisionId": "5f6de000-0000-4000-8000-000000000001"
      },
      "source": "TomeStack Fixtures: Combat",
      "toHit": 5,
      "versatileDamage": "1d10+3"
    }
  ],
  "character": {
    "classes": [
      {
        "hitDie": 10,
        "level": 3,
        "name": "Fixture Duelist",
        "ref": {
          "contentId": "5f6dc000-0000-4000-8000-000000000011",
          "revisionId": "5f6de000-0000-4000-8000-000000000011"
        },
        "source": "TomeStack Fixtures: Combat"
      }
    ],
    "level": 3,
    "name": "Test Armored Duelist",
    "rulesFamily": "srd-5.1"
  },
  "conditions": {
    "active": [],
    "exhaustion": 0
  },
  "dropped": [],
  "exportedAt": "2026-09-24T12:00:00+00:00",
  "features": [
    {
      "automation": "assisted",
      "kind": "class",
      "name": "Fixture Duelist",
      "ref": {
        "contentId": "5f6dc000-0000-4000-8000-000000000011",
        "revisionId": "5f6de000-0000-4000-8000-000000000011"
      },
      "source": "TomeStack Fixtures: Combat",
      "summary": "A test class: Str 13 or Dex 13 to multiclass; saves and two skills only as the starting class, one skill as a later class.",
      "texts": [
        "To multiclass into or out of this class: Strength 13 or Dexterity 13."
      ]
    },
    {
      "automation": "automatic",
      "kind": "item",
      "name": "Fixture Longblade",
      "ref": {
        "contentId": "5f6dc000-0000-4000-8000-000000000001",
        "revisionId": "5f6de000-0000-4000-8000-000000000001"
      },
      "source": "TomeStack Fixtures: Combat",
      "summary": "A test martial melee weapon.",
      "texts": []
    },
    {
      "automation": "automatic",
      "kind": "item",
      "name": "Fixture Iron Harness",
      "ref": {
        "contentId": "5f4dc000-0000-4000-8000-000000000003",
        "revisionId": "5f4de000-0000-4000-8000-000000000013"
      },
      "source": "TomeStack Fixtures: Equipment",
      "summary": "Heavy test armor.",
      "texts": [
        "Heavy armor: 17, no Dexterity modifier."
      ]
    },
    {
      "automation": "automatic",
      "kind": "item",
      "name": "Fixture Kite Shield",
      "ref": {
        "contentId": "5f4dc000-0000-4000-8000-000000000004",
        "revisionId": "5f4de000-0000-4000-8000-000000000014"
      },
      "source": "TomeStack Fixtures: Equipment",
      "summary": "A test shield.",
      "texts": [
        "Shield: +2 Armor Class."
      ]
    },
    {
      "automation": "automatic",
      "kind": "feature",
      "name": "Fixture Riposte",
      "ref": {
        "contentId": "5f6dc000-0000-4000-8000-000000000012",
        "revisionId": "5f6de000-0000-4000-8000-000000000012"
      },
      "source": "TomeStack Fixtures: Combat",
      "summary": "A test reaction roll.",
      "texts": []
    },
    {
      "automation": "automatic",
      "kind": "feature",
      "name": "Fixture Second Breath",
      "ref": {
        "contentId": "5f6dc000-0000-4000-8000-000000000013",
        "revisionId": "5f6de000-0000-4000-8000-000000000013"
      },
      "source": "TomeStack Fixtures: Combat",
      "summary": "A test bonus action with a use per short rest.",
      "texts": []
    }
  ],
  "fields": [
    {
      "automation": "automatic",
      "id": "armorClass",
      "label": "Armor Class",
      "overridden": false,
      "value": 19
    },
    {
      "automation": "automatic",
      "id": "initiative",
      "label": "Initiative",
      "overridden": false,
      "value": 1
    },
    {
      "automation": "automatic",
      "id": "proficiencyBonus",
      "label": "Proficiency bonus",
      "overridden": false,
      "value": 2
    },
    {
      "automation": "automatic",
      "id": "hitPoints",
      "label": "Hit point maximum",
      "overridden": false,
      "value": 28
    },
    {
      "automation": "automatic",
      "id": "spellAttack",
      "label": "Spell attack bonus",
      "overridden": false,
      "value": 0
    },
    {
      "automation": "automatic",
      "id": "spellSaveDc",
      "label": "Spell save DC",
      "overridden": false,
      "value": 0
    }
  ],
  "format": "tomestack.sheet",
  "formatVersion": 1,
  "hitDice": [
    {
      "die": 10,
      "spent": 0,
      "total": 3
    }
  ],
  "hitPoints": {
    "current": 28,
    "maximum": 28,
    "temporary": 0
  },
  "notices": [
    {
      "attribution": "Written for TomeStack tests.",
      "license": "Original test fixture",
      "publisher": "TomeStack project",
      "redistributable": true,
      "title": "TomeStack Fixtures: Combat",
      "totalsOnly": false
    },
    {
      "attribution": "Written for TomeStack tests.",
      "license": "Original test fixture",
      "publisher": "TomeStack project",
      "redistributable": true,
      "title": "TomeStack Fixtures: Equipment",
      "totalsOnly": false
    }
  ],
  "purpose": "share",
  "resources": [
    {
      "feature": "Fixture Second Breath",
      "label": "Second Breath",
      "maximum": 1,
      "recovery": [
        "ShortRest: all"
      ],
      "ref": {
        "contentId": "5f6dc000-0000-4000-8000-000000000013",
        "revisionId": "5f6de000-0000-4000-8000-000000000013"
      },
      "source": "TomeStack Fixtures: Combat",
      "spent": 0
    }
  ],
  "scales": [],
  "skills": [
    {
      "ability": "dex",
      "label": "Acrobatics",
      "proficiency": "none",
      "skill": "acrobatics",
      "total": 1
    },
    {
      "ability": "wis",
      "label": "Animal Handling",
      "proficiency": "none",
      "skill": "animalHandling",
      "total": 0
    },
    {
      "ability": "int",
      "label": "Arcana",
      "proficiency": "none",
      "skill": "arcana",
      "total": 0
    },
    {
      "ability": "str",
      "label": "Athletics",
      "proficiency": "none",
      "skill": "athletics",
      "total": 3
    },
    {
      "ability": "cha",
      "label": "Deception",
      "proficiency": "none",
      "skill": "deception",
      "total": -1
    },
    {
      "ability": "int",
      "label": "History",
      "proficiency": "none",
      "skill": "history",
      "total": 0
    },
    {
      "ability": "wis",
      "label": "Insight",
      "proficiency": "none",
      "skill": "insight",
      "total": 0
    },
    {
      "ability": "cha",
      "label": "Intimidation",
      "proficiency": "none",
      "skill": "intimidation",
      "total": -1
    },
    {
      "ability": "int",
      "label": "Investigation",
      "proficiency": "none",
      "skill": "investigation",
      "total": 0
    },
    {
      "ability": "wis",
      "label": "Medicine",
      "proficiency": "none",
      "skill": "medicine",
      "total": 0
    },
    {
      "ability": "int",
      "label": "Nature",
      "proficiency": "none",
      "skill": "nature",
      "total": 0
    },
    {
      "ability": "wis",
      "label": "Perception",
      "proficiency": "none",
      "skill": "perception",
      "total": 0
    },
    {
      "ability": "cha",
      "label": "Performance",
      "proficiency": "none",
      "skill": "performance",
      "total": -1
    },
    {
      "ability": "cha",
      "label": "Persuasion",
      "proficiency": "none",
      "skill": "persuasion",
      "total": -1
    },
    {
      "ability": "int",
      "label": "Religion",
      "proficiency": "none",
      "skill": "religion",
      "total": 0
    },
    {
      "ability": "dex",
      "label": "Sleight of Hand",
      "proficiency": "none",
      "skill": "sleightOfHand",
      "total": 1
    },
    {
      "ability": "dex",
      "label": "Stealth",
      "proficiency": "none",
      "skill": "stealth",
      "total": 1
    },
    {
      "ability": "wis",
      "label": "Survival",
      "proficiency": "none",
      "skill": "survival",
      "total": 0
    }
  ],
  "slots": [],
  "spellcasting": [],
  "toggles": []
}
