{
  "abilities": [
    {
      "ability": "str",
      "modifier": 0,
      "save": 0,
      "saveProficiency": "none",
      "score": 10
    },
    {
      "ability": "dex",
      "modifier": 3,
      "save": 3,
      "saveProficiency": "none",
      "score": 16
    },
    {
      "ability": "con",
      "modifier": 1,
      "save": 1,
      "saveProficiency": "none",
      "score": 12
    },
    {
      "ability": "int",
      "modifier": 0,
      "save": 0,
      "saveProficiency": "none",
      "score": 10
    },
    {
      "ability": "wis",
      "modifier": 1,
      "save": 1,
      "saveProficiency": "none",
      "score": 13
    },
    {
      "ability": "cha",
      "modifier": -1,
      "save": -1,
      "saveProficiency": "none",
      "score": 8
    }
  ],
  "attacks": [],
  "character": {
    "classes": [],
    "level": 1,
    "name": "Wren (2024 fixture)",
    "rulesFamily": "srd-5.2.1"
  },
  "conditions": {
    "active": [],
    "exhaustion": 0
  },
  "dropped": [],
  "exportedAt": "2026-09-24T12:00:00+00:00",
  "features": [
    {
      "automation": "automatic",
      "kind": "background",
      "name": "Fixture Courier",
      "ref": {
        "contentId": "5f0dc000-0000-4000-8000-000000000002",
        "revisionId": "5f0de000-0000-4000-8000-000000000002"
      },
      "source": "TomeStack Fixtures: 2024 Family",
      "summary": "A test background for messengers.",
      "texts": []
    },
    {
      "automation": "assisted",
      "kind": "species",
      "name": "Fixture Wanderer",
      "ref": {
        "contentId": "5f0dc000-0000-4000-8000-000000000003",
        "revisionId": "5f0de000-0000-4000-8000-000000000003"
      },
      "source": "TomeStack Fixtures: Shared",
      "summary": "A test species usable under both families; its ability increase only applies where species grant them.",
      "texts": []
    },
    {
      "automation": "reference",
      "kind": "feature",
      "name": "Fixture Star Sense",
      "ref": {
        "contentId": "5f0dc000-0000-4000-8000-000000000006",
        "revisionId": "5f0de000-0000-4000-8000-000000000006"
      },
      "source": "TomeStack Fixtures: Shared",
      "summary": "A test feature whose mechanic is not modeled yet.",
      "texts": [
        "When you roll initiative under starlight, roll twice and keep the higher result."
      ]
    }
  ],
  "fields": [
    {
      "automation": "automatic",
      "id": "armorClass",
      "label": "Armor Class",
      "overridden": false,
      "value": 13
    },
    {
      "automation": "automatic",
      "id": "initiative",
      "label": "Initiative",
      "overridden": false,
      "value": 3
    },
    {
      "automation": "automatic",
      "id": "proficiencyBonus",
      "label": "Proficiency bonus",
      "overridden": false,
      "value": 2
    },
    {
      "automation": "assisted",
      "id": "hitPoints",
      "label": "Hit point maximum",
      "overridden": false,
      "value": 0
    },
    {
      "automation": "automatic",
      "id": "spellAttack",
      "label": "Spell attack bonus",
      "overridden": false,
      "value": 0
    },
    {
      "automation": "automatic",
      "id": "spellSaveDc",
      "label": "Spell save DC",
      "overridden": false,
      "value": 0
    }
  ],
  "format": "tomestack.sheet",
  "formatVersion": 1,
  "hitDice": [],
  "hitPoints": {
    "current": 0,
    "maximum": 0,
    "temporary": 0
  },
  "notices": [
    {
      "attribution": "Written for TomeStack tests.",
      "license": "Original test fixture",
      "publisher": "TomeStack project",
      "redistributable": true,
      "title": "TomeStack Fixtures: 2024 Family",
      "totalsOnly": false
    },
    {
      "attribution": "Written for TomeStack tests.",
      "license": "Original test fixture",
      "publisher": "TomeStack project",
      "redistributable": true,
      "title": "TomeStack Fixtures: Shared",
      "totalsOnly": false
    }
  ],
  "purpose": "share",
  "resources": [],
  "scales": [],
  "skills": [
    {
      "ability": "dex",
      "label": "Acrobatics",
      "proficiency": "none",
      "skill": "acrobatics",
      "total": 3
    },
    {
      "ability": "wis",
      "label": "Animal Handling",
      "proficiency": "none",
      "skill": "animalHandling",
      "total": 1
    },
    {
      "ability": "int",
      "label": "Arcana",
      "proficiency": "none",
      "skill": "arcana",
      "total": 0
    },
    {
      "ability": "str",
      "label": "Athletics",
      "proficiency": "none",
      "skill": "athletics",
      "total": 0
    },
    {
      "ability": "cha",
      "label": "Deception",
      "proficiency": "none",
      "skill": "deception",
      "total": -1
    },
    {
      "ability": "int",
      "label": "History",
      "proficiency": "none",
      "skill": "history",
      "total": 0
    },
    {
      "ability": "wis",
      "label": "Insight",
      "proficiency": "none",
      "skill": "insight",
      "total": 1
    },
    {
      "ability": "cha",
      "label": "Intimidation",
      "proficiency": "none",
      "skill": "intimidation",
      "total": -1
    },
    {
      "ability": "int",
      "label": "Investigation",
      "proficiency": "none",
      "skill": "investigation",
      "total": 0
    },
    {
      "ability": "wis",
      "label": "Medicine",
      "proficiency": "none",
      "skill": "medicine",
      "total": 1
    },
    {
      "ability": "int",
      "label": "Nature",
      "proficiency": "none",
      "skill": "nature",
      "total": 0
    },
    {
      "ability": "wis",
      "label": "Perception",
      "proficiency": "none",
      "skill": "perception",
      "total": 1
    },
    {
      "ability": "cha",
      "label": "Performance",
      "proficiency": "none",
      "skill": "performance",
      "total": -1
    },
    {
      "ability": "cha",
      "label": "Persuasion",
      "proficiency": "none",
      "skill": "persuasion",
      "total": -1
    },
    {
      "ability": "int",
      "label": "Religion",
      "proficiency": "none",
      "skill": "religion",
      "total": 0
    },
    {
      "ability": "dex",
      "label": "Sleight of Hand",
      "proficiency": "none",
      "skill": "sleightOfHand",
      "total": 3
    },
    {
      "ability": "dex",
      "label": "Stealth",
      "proficiency": "none",
      "skill": "stealth",
      "total": 3
    },
    {
      "ability": "wis",
      "label": "Survival",
      "proficiency": "none",
      "skill": "survival",
      "total": 1
    }
  ],
  "slots": [],
  "spellcasting": [],
  "toggles": []
}
